{
  "schema": "sharehub-sdk-package-draft-1",
  "exampleOnly": true,
  "sdkVersion": "0.1.0-layout-example.1",
  "productTarget": "0.1.0",
  "channel": "internal-candidate",
  "target": {
    "os": "macos",
    "architectures": [
      "arm64",
      "x86_64"
    ],
    "minimumOs": null,
    "runtimeDependencies": [],
    "runtimeInspectionComplete": false
  },
  "apiCompatibility": [
    {
      "package": "share_hub_media_api",
      "minInclusive": "0.8.0",
      "maxExclusive": "0.9.0",
      "testedVersions": []
    },
    {
      "package": "share_hub_session_api",
      "minInclusive": "0.1.0",
      "maxExclusive": "0.2.0",
      "testedVersions": []
    }
  ],
  "nativeAbi": {
    "family": "sharehub-media-c",
    "stability": "draft",
    "draftRevision": 2,
    "requiredFeatures": []
  },
  "capabilities": [],
  "signing": {
    "status": "unverified",
    "reportPath": null
  },
  "licenseFiles": [
    "licenses/LICENSE.sdk.txt",
    "licenses/THIRD_PARTY_NOTICES.txt"
  ],
  "validationFile": "metadata/validation.json",
  "inventoryComplete": false,
  "artifactId": "native-macos-universal-example",
  "kind": "native",
  "publicSnapshots": [],
  "files": [
    {
      "type": "file",
      "path": "frameworks/ShareHubMedia.xcframework/macos-arm64_x86_64/ShareHubMedia.framework/Versions/A/ShareHubMedia",
      "role": "private-core-binary",
      "sizeBytes": null,
      "sha256": null
    },
    {
      "type": "file",
      "path": "frameworks/WebRTC.xcframework/macos-arm64_x86_64/WebRTC.framework/Versions/A/WebRTC",
      "role": "upstream-binary",
      "sizeBytes": null,
      "sha256": null
    },
    {
      "type": "file",
      "path": "include/share_hub_media.h",
      "role": "public-header",
      "sizeBytes": null,
      "sha256": null
    },
    {
      "type": "file",
      "path": "include/share_hub_media_operations.h",
      "role": "public-header",
      "sizeBytes": null,
      "sha256": null
    },
    {
      "type": "file",
      "path": "licenses/LICENSE.sdk.txt",
      "role": "license",
      "sizeBytes": null,
      "sha256": null
    },
    {
      "type": "file",
      "path": "licenses/THIRD_PARTY_NOTICES.txt",
      "role": "license",
      "sizeBytes": null,
      "sha256": null
    },
    {
      "type": "file",
      "path": "metadata/build.json",
      "role": "build-metadata",
      "sizeBytes": null,
      "sha256": null
    },
    {
      "type": "file",
      "path": "metadata/validation.json",
      "role": "validation-metadata",
      "sizeBytes": null,
      "sha256": null
    }
  ]
}
